post_id,comment_author,comment_body,comment_score
1jerzg3,Own-Basis-3706,SO FUCKIN COOL!!! ,6
1jerzg3,flaneur9777,Wish this was our main Jersey.,5
1jerzg3,ipriyanshk20,Letsgoo🔥,3
1jerzg3,Big-Particular-458,"Yeah, it would have been cool.",2
1jewt3q,Capable-Magician-418,"Supporting and investing in players, that's something i won't even doubt in case of RR. Let him focus on his practice to make a comeback, reels waghera toh banti rahegi.",5
1jewt3q,ipriyanshk20,No need to worry about this thing when you have a certain Dravid in the team.,1
1jewt3q,gsgooldy,Bro ye luminous wale add me aaya hai fans k beech me... Tabhi muje laga k iss se ye faltu k kaam naa kara karao har koi enjoy nahi karta ye sab.,4
1jepet4,div2starsatredit,nost LSG in a million possibilities!,14
1jepet4,dedupe1,"[https://www.youtube.com/watch?v=Cod\_x8omzdg&ab\_channel=Beyond23CricketPodcast](https://www.youtube.com/watch?v=Cod_x8omzdg&ab_channel=Beyond23CricketPodcast)

The full video is here and the predictions are the last sections.

He predicts : KKR, SRH, LSG, RR. I can't believe LSG was so easy for him to pick above RR probably biased towards langer.",9
1jepet4,DesiNPC,Where did he say?,1
1jepet4,GunnerByHeart,"Don't believe anyone who saying LSG will qualify and CSK not. That shows how dumb his analysis is. They just say team names based on their agenda/PR etc.

Their best 12 combination likely as below as per Cricinfo.

Aiden Markram, Mitchell Marsh, Nicholas Pooran, Rishabh Pant (c & wk), Ayush Badoni, David Miller, Shahbaz Ahmed, Abdul Samad, Akash Singh, Ravi Bishnoi, Akash Deep, Manimaran Siddarth

Tell me if there is any dependable bowler in LSG. even if they score 200-220 opposition will chase it easily.

Also their middle order seems ok-ok only. In Batting they are relying too much on foreign players like Aiden Markram, Mitchell Marsh, Nicholas Pooran, David Miller, out of these only Pooran will be consistently successful on their home ground which favors spin. This team will really struggle on spinning pitches.

I don't know RR will qualify or not but for LSG to qualify their top order should have a very outstanding season",1
1jepet4,Kchinki,"Yeah true. On paper great team. But I don’t see Pant’s captaincy, opening pair and the Indian bowlers having a full season without injury at all.",4
1jepet4,Soggy_Ad_3686,"I get your point about LSG, don’t agree with CSK. CSK doesn’t look too good on paper. A pretty ordinary team. Although they always overachieve",3
1jepet4,GunnerByHeart,"CSK looks good for their pitch. Very Balanced.

Ruturaj Gaikwad (c), Rachin Ravindra, Rahul Tripathi, Shivam Dube, Vijay Shankar/Deepak Hooda, Sam Curran, Ravindra Jadeja, Ravichandran Ashwin, MS Dhoni (wk), Khaleel Ahmed, Matheesha Pathirana, Noor Ahmad/Jamie Overton

look at this bowling lineup Ravindra Jadeja, Ravichandran Ashwin, Matheesha Pathirana, Noor Ahmad/Jamie Overton , Khaleel Ahmed, 

All gun bowler for their pitch Khaleel Ahmed is their 5th and weakest bowler , who could have been 2nd bowler in different teams.

Also they have batting depth due to all rounders. Dhoni coming in at 8/9. if Dhoni performs average and not become liability then they are good enough. Plus they have IPL winning experience.",2
1jevj3v,Big-Particular-458,"They wanted Boult mostly. They knew MI would go to length for Boult. They weren't sure they would get Boult as well as MI had plenty of money. So they went till 12.5 for Jofra.

Basically, they wanted a good pacer. 

Naman Dhir yes, like to like for Rana.

Ashwin Anna - don't know why they went for him till 9 cr. Paise hi nahi the itne. Aa jata to lanka lag jati.

Aise to Arshdeep Buttler and Chahal kr piche bhi bhage the ye log. 
.",1
1jevj3v,ipriyanshk20,"They wanted Naman Dhir, I could sense that 100%
and surely they paid Jurel 14 cr to play up the order and then play Dhir at 5.

I will not be surprised if Rana plays at 5, because Jurel’s best will come in top 3 only.",1
1jevj3v,Capable-Magician-418,"They didn't bid for chahal and it makes sense coz they couldn't as his price went beyond rr's scope when he crossed 8-9 cr., also we had an option to get cheaper foreign spinners.",1
1jevj3v,Only_Sea_3140,"Naman Dhir like to like nhi h rana ka Naman Dhir hota toh Jurel ko no 3 pe push kr dete waha uska best utilisation hota Rana no.5 pe nhi khel sakta

Ashwin wala hum lucky the isliye Bach gye

Arshdeep ka toh bs wo 18cr tak lejana chate the isliye Kiya SRH ne bhi ye hi Kiya tha

Buttler ka 9cr tak keval fans ko khus krne k liye paddle uthaya unko pta tha wo 10 se kam m nhi milega

Chahal k liye toh  paddle hi nhi uthaya ek baar bhi chahal ka toh wo bahut clear the ki nhi chahiye ye",1
1jevj3v,Substantial-Cake-857,"Nah man , Jurel was paid 14 cr because he is a perfect no.5 in T20s. , can play both spin and pace well and also is a good finisher(2023 season)",1
1jevj3v,Big-Particular-458,I'm not sure. They tried the same with Uthappa. He played him at a position he wasn't neant to and had a bad season.,1
1jevj3v,ipriyanshk20,Wese dekha jaaye toh Rana ke best stats number 5 pe hi hai IPL me.,2
1jevj3v,ipriyanshk20,"Not really man, he is such a class act player, its not like he will not do good at 5 but he will be a beast in top 3. 
You ideally want your best bats to play most number of balls. I know it might be Rana only at 3 but Jurel at 3 and KSR at 5 is something a fanboy in me wants.",2
1jevj3v,ipriyanshk20,"The thing is DDP, Uthappa all these players failed even when they were sent to open.

I hope Rana if plays at 3 atleast can give is a 350 run season, anything less than that is wasting the potential that we have on bench.",1
1jevj3v,Only_Sea_3140,Rana ko number 5 pe hi try Krna chahiye nhi chale toh KSR se replace kr dena chahiye iski wajah se Jurel ko underutilize nhi Krna chahiye,2
1jevj3v,Substantial-Cake-857,"Thing is if he plays at 3 , pur lower middle order looks really weak in case of a collapse , if he plays at 5 the top order players will be able to play freely knowing that jurel is yet to come. Also it's about playing a role not playing more balls , for example klaasen also comes at no.5 and is probably the best player in the world",2
1jevj3v,ScreenOtherwise7641,I really thought they would go for tripathi given his performance in playoffs. He also took on ashwin in sf reducing the pressure. He was a steal for csk.,1
1jevj3v,ipriyanshk20,"Wahi bhai, mujhe bas lag raha hai that Dravid has something in store for Jurel this season. 14 CR diya hai to uska utilisation to hoga.

Rana is not a long term project for us anyways, I would rather have KSR our local boy playing at 5 man. But this will happen when Rana eventually fails.",2
1jevj3v,ipriyanshk20,Fair enough,1
1jevj3v,ipriyanshk20,"They wanted someone who can bowl too thats why went for Dhir, Rana and even Krunal",1
1jevj3v,Only_Sea_3140,Dravid ka eye talent glt nhi ho sakta isliye hi mujhe Jurel se itni ummid h bs usko no 3 se hi start krwaye,2
1jevj3v,ScreenOtherwise7641,Did not bid for shahbaz. He is a good batter and performed well for srh with both bat and ball. Not a top order batter though more like ashwin axar types.,1
1jevj3v,ipriyanshk20,"Rarely hi koi player apne debut season ya apne debut game me impact daal paata hai chahe IPL ho ya international. This guy has nerves of steel.

Pehle test series me MOTM as a WK and series saving innings kheli.

Penle IPL game me almost won it for us.",3
1jevirc,abskkr24,"Don't forget Jofra and his golf swing sixes, the guy used to blast those at number 7 (and even at 6 once or twice) for us last time he was in RR!!",5
1jevirc,ipriyanshk20,Ideally this should be the lineup but deshpande will play surely and theekshana might be IP or Sandeep,5
1jevirc,Few_Measurement_5335,"Would have Deshpande in place of Shubham Dubey, would play theekshana in jaipur and chepauk, instead of faruqi. Also Parag and Rana are not IPL level bowlers yet, they might be decent in domestic, but not in ipl. so to count them as bowlers would be a stretch.",0
1jevirc,Bunnyismm,Last this season,-10
1jevirc,Connect-Barracuda-66,He is our party time opener as well /s,1
1jevirc,superstrikes1999,Looks like RCB fans still haven’t forgotten the beating we gave them in two IPL playoffs.,6
1jevirc,ishahahant,"https://preview.redd.it/kgsnzlke7npe1.jpeg?width=409&format=pjpg&auto=webp&s=4d5525aa7b42f0df12012bd0c81bf33540942d6d

Your comment karma says a lot about your opinion",5
1jevirc,yash_ag01,https://preview.redd.it/merpka26knpe1.png?width=1080&format=png&auto=webp&s=80544845345d35d8c997aa64c4a6bbaad85bb803,1
1jevirc,Bunnyismm,Being honest This time RR not looking dangerous No good bowling younger Middle order indian batsman who can't take pressure its all about Samsun this year Last 3 years were golden for them bcoz they have that kind of combination this year nah,-7
1jevirc,Bunnyismm,Logo ki Gaande jalata huna is liye 🤡,-2
1jevirc,superstrikes1999,Focus on your 10 time winners team please,6
1jevirc,Bunnyismm,Lol if u can't hear the truth you should not post it you want honest opinion but when give you got offended lol,-6
1jevirc,superstrikes1999,The only truth is Haarcb is trophyless and what’s your obsession with RR your posts and comments are all about hatewatching them,6
1jevirc,Capable-Magician-418,"Bhai isko ignore maaro, isse bada clown nahi hai ipl subs me ye baat sab jaante hai. Most likely 11-12 saal ka bewkoof bacha hai ye.",3
1jevirc,Bunnyismm,Still more popular than you 😭 Winning 1 title still nobody even talk about this franchise lol,-1
1jevirc,Bunnyismm,Tere baap se bada hu LO DU,0
1jevirc,ipriyanshk20,You are just there for the memes,2
1jevirc,DesiNPC,RCB’s middle order is dependent on 3 English batsmen in Indian conditions. You shouldn’t really talk about any other team’s middle order,1
1jevirc,Capable-Magician-418,Haan tu lodu hi hai budhe,3
1jevirc,Bunnyismm,Im here for the truth,0
1jevirc,Bunnyismm,"But we accept the truth, we don't get offend",1
1jevirc,Bunnyismm,To fir muh me ku le raha he behes karke,0
1jevirc,DesiNPC,You just got offended in this very thread 🤣,1
1jexjb1,flaneur9777,Boult chahal ashwin weren't stars and made them stars? I need that blunt bro ..,1
1jeqfs3,ipriyanshk20,Today they play another practice game,2
1jeqfs3,CheapSuccotash3128,will scores be available?,2
1jeqfs3,ipriyanshk20,No i guess,1
1je52y4,Beautiful-Speaker-60,Wait till you remember our campaign from 2019 to 2021 along with those jerseys,28
1je52y4,roohnair,# Still Haunting me... Sandy no ball and last ball 6,19
1je52y4,Kchinki,Hopefully Rahul Dravid changes things a bit.,12
1je52y4,ScreenOtherwise7641,Dont you remember how buttler got  out to pandya and that catch drop of gill by yuzi in 2022,12
1je52y4,AffectionatePlan9476,I think that was mainly due to experimenting n very poor performance by whole team neither batting nor bowling clicked in last matches,5
1je52y4,vergil045,Won 4 out of 5 in 2023 and couldn't qualify,5
1je52y4,div2starsatredit,"![gif](giphy|3o6ZtpRoYe9wbyfcBi)

kya yaad dila diya!",2
1je52y4,Anonymous,[deleted],2
1je52y4,Every-Finish5634,releasing jos butler,0
1je52y4,thatShawarmaGuy,"Oh f*ck no. Those were DARK times. Like, dark af man. ",16
1je52y4,flaneur9777,![gif](giphy|hyyV7pnbE0FqLNBAzs|downsized),5
1je52y4,div2starsatredit,"we don't talk about the darkages

that history will be deleted after our IPL victory!",5
1je52y4,flaneur9777,![gif](giphy|d7rvF20PqNuGKSQGhf),2
1je52y4,golpappa,I went to the stadium to watch the same my friends and I were happy that we witnessed a last ball thriller but when we reached at the exit some person shouted match is still onn and all I remember is a bustle sound of fans going crazy and I saw the ball flying 😭😭,2
1je52y4,flaneur9777,Yes.. I pray that they take the second half of the ipl seriously,7
1je52y4,Top-Influence3789,Those what if,1
1je52y4,Capable-Magician-418,"Bro, don't u know that we r not allowed to talk about that?  Forget that shit, like completely delete it.",1
1je52y4,Capable-Magician-418,"Move on, for god's sake. Why does someone always have to keep bringing jos again and again like jos was the one who took us to the playoffs last season. He didn't, it was Samson and parag in batting.",3
1je52y4,Tooty__fruity,"Better than crashing out in 2023 , that still haunts me 😭",2
1je52y4,Every-Finish5634,"this auction was a nightmare for royals. released jos,trent,powell and choosing jurel, archer and some other players which i don't think will perform in this ipl. they bought the youngest chap was there any need to buy him. India have many players which have much more strength experience and like himmat singh .I am not an expert but I am sure this time we are not making into playoffs. 
this is the side  looks same to the 20-21 side",1
1je52y4,Innocentvisitor69,He actually did.. If Jaiswal does fire big time we will be on table bottom probably,-1
1je52y4,Capable-Magician-418,"If u r not an expert then it's better to not be so sure lol, acting like dravid and sanga are fools",2
1je52y4,Capable-Magician-418,"Go and check the matches and his performance, just coz of the hundreds u r forgetting the poor performance of other matches.",5
1je52y4,anonymus_G,I mean he did made us get 4 points and got 359 runs in 11 matches. might have crossed 500 if he played 16 like others.,1
1je52y4,Innocentvisitor69,Thik h bhai dhruv Jurel and parag will take us to final🤡,-3
1je52y4,Capable-Magician-418,"He made most of the runs in the 2 matches and was a liability in the rest of the matches. I have already made posts about it if u can't see that and open ur eyes then there is nothing to say. Even nitish rana wins atleast 2 matches every season he played for kkr. Hetmyer won us many lost matches as well so why are people so interested in letting him go? Our management had only 6 slots to retain and they made the choices which were best for rr, not for just this season but for the complete cycle and for the future of RR. Love buttler like every RR fan should do but stop bringing the team down being stuck in the past.",1
1je52y4,Capable-Magician-418,"Yeah bro and if they take us then don't start praising them doing a flip, negative idiots like u act like experts and then end up lookin like clowns. This management has people who other franchises will give blank checks to have so at least be a decent supporter and trust them for one season, if we fail then start what ever crying u all keep doing",5
1je52y4,Batboix3107,Very true butler had a huge impact in our 2022 RR campaign but was a huge flop in the successive two seasons also his availability issues cost us two playoffs glad we didn’t go for a single English batsman this season,3
1je52y4,Only-Pound4276,Jofra England ka hi hai bhai.. jab koi english liya ni toh jofra bhi mast MI ko chipka dete 13 cr me. unke paas boulty jitna budget hi na bachta..,1
1je52y4,Batboix3107,I said English batsman ! Also With the kind of form jofra is in he will probably be dropped from the 11 after 2-3 games lol,0
1je52y4,Only-Pound4276,wahi tohhhh. sala 14 cr waste kr diya 2 players aa jte theek thaak se,1
1je3la1,anonymus_G,live score bot would be used for the season which will serve as megathread posts too so dnw,3
1jec9lb,ipriyanshk20,"Viral infection 
Recovering",3
